mysql: [Warning] C:\Program Files\MySQL\MySQL Server 8.0\bin\mysql.exe: ignoring option '--no-beep' due to invalid value ''.
Enter password: ****
Welcome to the MySQL monitor.  Commands end with ; or \g.
Your MySQL connection id is 22
Server version: 8.0.22 MySQL Community Server - GPL

Copyright (c) 2000, 2020, Oracle and/or its affiliates. All rights reserved.

Oracle is a registered trademark of Oracle Corporation and/or its
affiliates. Other names may be trademarks of their respective
owners.

Type 'help;' or '\h' for help. Type '\c' to clear the current input statement.

mysql> help;

For information about MySQL products and services, visit:
   http://www.mysql.com/
For developer information, including the MySQL Reference Manual, visit:
   http://dev.mysql.com/
To buy MySQL Enterprise support, training, or other products, visit:
   https://shop.mysql.com/

List of all MySQL commands:
Note that all text commands must be first on line and end with ';'
?         (\?) Synonym for `help'.
clear     (\c) Clear the current input statement.
connect   (\r) Reconnect to the server. Optional arguments are db and host.
delimiter (\d) Set statement delimiter.
ego       (\G) Send command to mysql server, display result vertically.
exit      (\q) Exit mysql. Same as quit.
go        (\g) Send command to mysql server.
help      (\h) Display this help.
notee     (\t) Don't write into outfile.
print     (\p) Print current command.
prompt    (\R) Change your mysql prompt.
quit      (\q) Quit mysql.
rehash    (\#) Rebuild completion hash.
source    (\.) Execute an SQL script file. Takes a file name as an argument.
status    (\s) Get status information from the server.
system    (\!) Execute a system shell command.
tee       (\T) Set outfile [to_outfile]. Append everything into given outfile.
use       (\u) Use another database. Takes database name as argument.
charset   (\C) Switch to another charset. Might be needed for processing binlog with multi-byte charsets.
warnings  (\W) Show warnings after every statement.
nowarning (\w) Don't show warnings after every statement.
resetconnection(\x) Clean session context.

For server side help, type 'help contents'

mysql> show databases;
+--------------------+
| Database           |
+--------------------+
| information_schema |
| mysql              |
| new_schema         |
| patel              |
| performance_schema |
| reconidid          |
| sys                |
+--------------------+
7 rows in set (0.31 sec)

mysql> create database testdb
    -> ^C
mysql> craete database testdb;
ERROR 1064 (42000): You have an error in your SQL syntax; check the manual that corresponds to your MySQL server version for the right syntax to use near 'craete database testdb' at line 1
mysql> CREATE DATABASE testdb
    -> ^C
mysql> CREATE DATABASE testdb;
Query OK, 1 row affected (1.10 sec)

mysql> show databases
    -> ^C
mysql> show databases;
+--------------------+
| Database           |
+--------------------+
| information_schema |
| mysql              |
| new_schema         |
| patel              |
| performance_schema |
| reconidid          |
| sys                |
| testdb             |
+--------------------+
8 rows in set (0.00 sec)

mysql> drop database testdb
    -> ^C
mysql> drop database testdb;
Query OK, 0 rows affected (1.50 sec)

mysql> show databases
    -> ^C
mysql> show databases;
+--------------------+
| Database           |
+--------------------+
| information_schema |
| mysql              |
| new_schema         |
| patel              |
| performance_schema |
| reconidid          |
| sys                |
+--------------------+
7 rows in set (0.00 sec)

mysql> create database payroll_service;
Query OK, 1 row affected (0.20 sec)

mysql> show database
    -> ^C
mysql> show database;
ERROR 1064 (42000): You have an error in your SQL syntax; check the manual that corresponds to your MySQL server version for the right syntax to use near 'database' at line 1
mysql> show databases;
+--------------------+
| Database           |
+--------------------+
| information_schema |
| mysql              |
| new_schema         |
| patel              |
| payroll_service    |
| performance_schema |
| reconidid          |
| sys                |
+--------------------+
8 rows in set (0.16 sec)

mysql> use payroll_service;
Database changed
mysql> select database();
+-----------------+
| database()      |
+-----------------+
| payroll_service |
+-----------------+
1 row in set (0.00 sec)

mysql> create table employee_payroll;
ERROR 1113 (42000): A table must have at least 1 column
mysql> create table employee_payroll(id INT unsigned NOT NULL AUTO_INCREMENT,name VARCHAR(150) NOT NULL,
    -> create table employee_payroll(id INT unsigned NOT NULL AUTO_INCREMENT,name VARCHAR(150) NOT NULL,
    -> salary Double NOT NULL,
    -> start DATE NOT NULL,
    -> PRIMARY KEY (id)
    -> );
ERROR 1064 (42000): You have an error in your SQL syntax; check the manual that corresponds to your MySQL server version for the right syntax to use near 'create table employee_payroll(id INT unsigned NOT NULL AUTO_INCREMENT,name VARCH' at line 2
mysql> create table employee_payroll
    -> (
    -> id INT unsigned NOT NULL AUTO_INCREMENT,
    -> name VARCHAR(150) NOT NULL,
    -> salary Double NOT NULL,
    -> start DATE NOT NULL,
    -> PRIMARY KEY (id)
    -> );
Query OK, 0 rows affected (3.80 sec)

mysql> describe employee_payroll;
+--------+--------------+------+-----+---------+----------------+
| Field  | Type         | Null | Key | Default | Extra          |
+--------+--------------+------+-----+---------+----------------+
| id     | int unsigned | NO   | PRI | NULL    | auto_increment |
| name   | varchar(150) | NO   |     | NULL    |                |
| salary | double       | NO   |     | NULL    |                |
| start  | date         | NO   |     | NULL    |                |
+--------+--------------+------+-----+---------+----------------+
4 rows in set (0.19 sec)

mysql> INSERT INTO employee_payroll(name,salary,start) VALUES
    -> ('Jitendra',10000.00,'2020-01-14'),
    -> ('Ram',5000.00,'2020-02-20'),
    -> ('Champa',78906.87,'2020-09-07');
Query OK, 3 rows affected (0.53 sec)
Records: 3  Duplicates: 0  Warnings: 0

mysql> SELECT * FROM employee_payroll
    -> ^C
mysql> SELECT * FROM employee_payroll;
+----+----------+----------+------------+
| id | name     | salary   | start      |
+----+----------+----------+------------+
|  1 | Jitendra |    10000 | 2020-01-14 |
|  2 | Ram      |     5000 | 2020-02-20 |
|  3 | Champa   | 78906.87 | 2020-09-07 |
+----+----------+----------+------------+
3 rows in set (0.00 sec)

mysql> select salary from employee_payroll where name="Jitendra";
+--------+
| salary |
+--------+
|  10000 |
+--------+
1 row in set (0.00 sec)

mysql> select * from employee_payroll where name="Jitendra";
+----+----------+--------+------------+
| id | name     | salary | start      |
+----+----------+--------+------------+
|  1 | Jitendra |  10000 | 2020-01-14 |
+----+----------+--------+------------+
1 row in set (0.00 sec)

mysql> select * from employee_payroll where name="jitendra";
+----+----------+--------+------------+
| id | name     | salary | start      |
+----+----------+--------+------------+
|  1 | Jitendra |  10000 | 2020-01-14 |
+----+----------+--------+------------+
1 row in set (0.00 sec)

mysql> select*from employee_payroll where name="jitendra";
+----+----------+--------+------------+
| id | name     | salary | start      |
+----+----------+--------+------------+
|  1 | Jitendra |  10000 | 2020-01-14 |
+----+----------+--------+------------+
1 row in set (0.00 sec)

mysql> select * from employee_payroll
    -> where start BETWEEN CAST('2018-01-01' AS DATE) AND DATE(NOW());
+----+----------+----------+------------+
| id | name     | salary   | start      |
+----+----------+----------+------------+
|  1 | Jitendra |    10000 | 2020-01-14 |
|  2 | Ram      |     5000 | 2020-02-20 |
|  3 | Champa   | 78906.87 | 2020-09-07 |
+----+----------+----------+------------+
3 rows in set (0.09 sec)

mysql> alter table employee_payroll add gender CHAR(1) AFTER name;
Query OK, 0 rows affected (4.34 sec)
Records: 0  Duplicates: 0  Warnings: 0

mysql> select*from employee_payroll;
+----+----------+--------+----------+------------+
| id | name     | gender | salary   | start      |
+----+----------+--------+----------+------------+
|  1 | Jitendra | NULL   |    10000 | 2020-01-14 |
|  2 | Ram      | NULL   |     5000 | 2020-02-20 |
|  3 | Champa   | NULL   | 78906.87 | 2020-09-07 |
+----+----------+--------+----------+------------+
3 rows in set (0.00 sec)

mysql> describe employee_payrol;
ERROR 1146 (42S02): Table 'payroll_service.employee_payrol' doesn't exist
mysql> describe employee_payroll;
+--------+--------------+------+-----+---------+----------------+
| Field  | Type         | Null | Key | Default | Extra          |
+--------+--------------+------+-----+---------+----------------+
| id     | int unsigned | NO   | PRI | NULL    | auto_increment |
| name   | varchar(150) | NO   |     | NULL    |                |
| gender | char(1)      | YES  |     | NULL    |                |
| salary | double       | NO   |     | NULL    |                |
| start  | date         | NO   |     | NULL    |                |
+--------+--------------+------+-----+---------+----------------+
5 rows in set (0.10 sec)

mysql> update employee_payroll set gender='F' where name='Champa';
Query OK, 1 row affected (0.12 sec)
Rows matched: 1  Changed: 1  Warnings: 0

mysql> describe employee_payroll;
+--------+--------------+------+-----+---------+----------------+
| Field  | Type         | Null | Key | Default | Extra          |
+--------+--------------+------+-----+---------+----------------+
| id     | int unsigned | NO   | PRI | NULL    | auto_increment |
| name   | varchar(150) | NO   |     | NULL    |                |
| gender | char(1)      | YES  |     | NULL    |                |
| salary | double       | NO   |     | NULL    |                |
| start  | date         | NO   |     | NULL    |                |
+--------+--------------+------+-----+---------+----------------+
5 rows in set (0.16 sec)

mysql> select*from employee_payroll;
+----+----------+--------+----------+------------+
| id | name     | gender | salary   | start      |
+----+----------+--------+----------+------------+
|  1 | Jitendra | NULL   |    10000 | 2020-01-14 |
|  2 | Ram      | NULL   |     5000 | 2020-02-20 |
|  3 | Champa   | F      | 78906.87 | 2020-09-07 |
+----+----------+--------+----------+------------+
3 rows in set (0.13 sec)

mysql> update employee_payroll set gender='M' where name='Jitendra';
Query OK, 1 row affected (0.20 sec)
Rows matched: 1  Changed: 1  Warnings: 0

mysql> update employee_payroll set gender='M' where name='Ram';
Query OK, 1 row affected (0.18 sec)
Rows matched: 1  Changed: 1  Warnings: 0

mysql> select*from employee_payroll;
+----+----------+--------+----------+------------+
| id | name     | gender | salary   | start      |
+----+----------+--------+----------+------------+
|  1 | Jitendra | M      |    10000 | 2020-01-14 |
|  2 | Ram      | M      |     5000 | 2020-02-20 |
|  3 | Champa   | F      | 78906.87 | 2020-09-07 |
+----+----------+--------+----------+------------+
3 rows in set (0.00 sec)

mysql> update employee_payroll set salary=3000000.00 where name='Jitendra';
Query OK, 1 row affected (0.07 sec)
Rows matched: 1  Changed: 1  Warnings: 0

mysql> select*from employee_payroll;
+----+----------+--------+----------+------------+
| id | name     | gender | salary   | start      |
+----+----------+--------+----------+------------+
|  1 | Jitendra | M      |  3000000 | 2020-01-14 |
|  2 | Ram      | M      |     5000 | 2020-02-20 |
|  3 | Champa   | F      | 78906.87 | 2020-09-07 |
+----+----------+--------+----------+------------+
3 rows in set (0.12 sec)

mysql> select sum(salary)from employee_payroll;
+-------------+
| sum(salary) |
+-------------+
|  3083906.87 |
+-------------+
1 row in set (0.12 sec)

mysql> select avg(salary) from employee_payroll;
+--------------------+
| avg(salary)        |
+--------------------+
| 1027968.9566666667 |
+--------------------+
1 row in set (0.00 sec)

mysql> select avg(salary) from employee_payroll where gender='m' group by name;
+-------------+
| avg(salary) |
+-------------+
|     3000000 |
|        5000 |
+-------------+
2 rows in set (0.12 sec)

mysql> select avg(salary) from employee_payroll where gender='m' group by gender;
+-------------+
| avg(salary) |
+-------------+
|     1502500 |
+-------------+
1 row in set (0.00 sec)

mysql> select avg(salary) from employee_payroll where group by gender;
ERROR 1064 (42000): You have an error in your SQL syntax; check the manual that corresponds to your MySQL server version for the right syntax to use near 'group by gender' at line 1
mysql> select avg(salary) from employee_payroll where gender='m' group by gender;
+-------------+
| avg(salary) |
+-------------+
|     1502500 |
+-------------+
1 row in set (0.00 sec)

mysql> select avg(salary) from employee_payroll where gender='m';
+-------------+
| avg(salary) |
+-------------+
|     1502500 |
+-------------+
1 row in set (0.00 sec)

mysql> select avg(salary) from employee_payroll  group by gender;
+-------------+
| avg(salary) |
+-------------+
|     1502500 |
|    78906.87 |
+-------------+
2 rows in set (0.00 sec)

mysql> select avg(salary) from employee_payroll  group by name;
+-------------+
| avg(salary) |
+-------------+
|     3000000 |
|        5000 |
|    78906.87 |
+-------------+
3 rows in set (0.00 sec)

mysql> select gender,count(name) from employee_payroll group by gender;
+--------+-------------+
| gender | count(name) |
+--------+-------------+
| M      |           2 |
| F      |           1 |
+--------+-------------+
2 rows in set (0.10 sec)

mysql> create database addressBook
    -> ^C
mysql> create database addressBook;
Query OK, 1 row affected (0.83 sec)

mysql> show databases;
+--------------------+
| Database           |
+--------------------+
| addressbook        |
| information_schema |
| mysql              |
| new_schema         |
| patel              |
| payroll_service    |
| performance_schema |
| reconidid          |
| sys                |
+--------------------+
9 rows in set (0.24 sec)

mysql> describe database name;
ERROR 1064 (42000): You have an error in your SQL syntax; check the manual that corresponds to your MySQL server version for the right syntax to use near 'database name' at line 1
mysql> describe addressBook
    -> ^C
mysql> describe addressBook;
ERROR 1146 (42S02): Table 'payroll_service.addressbook' doesn't exist
mysql> use addressBook;
Database changed
mysql> describe addressBook;
ERROR 1146 (42S02): Table 'addressbook.addressbook' doesn't exist
mysql> select database();
+-------------+
| database()  |
+-------------+
| addressbook |
+-------------+
1 row in set (0.00 sec)

mysql> describe addressBook;
ERROR 1146 (42S02): Table 'addressbook.addressbook' doesn't exist
mysql> create table address_book
    -> (id INT unsigned NOT NULL AUTO_INCREMENT,
    -> first_name VARCHAR(150) NOT NULL,
    -> last_name VARCHAR(150),
    -> address VARCHAR(150) NOT NULL,
    -> city VARCHAR(150) NOT NULL,
    -> state VARCHAR(150) NOT NULL,
    -> ZIP INT NOT NULL,
    -> phone_number VARCAHR(10) NOT NULL,
    -> email VARCHAR(50) NOT NULL,
    -> PRIMARY KEY (id)
    -> );
ERROR 1064 (42000): You have an error in your SQL syntax; check the manual that corresponds to your MySQL server version for the right syntax to use near 'VARCAHR(10) NOT NULL,
email VARCHAR(50) NOT NULL,
PRIMARY KEY (id)
)' at line 9
mysql>  create table address_book
    ->     -> (id INT unsigned NOT NULL AUTO_INCREMENT,
    ->     -> first_name VARCHAR(150) NOT NULL,
    ->     -> last_name VARCHAR(150),
    ->     -> address VARCHAR(150) NOT NULL,
    ->     -> city VARCHAR(150) NOT NULL,
    ->     -> state VARCHAR(150) NOT NULL,
    ->     -> ZIP INT NOT NULL,
    ->     -> phone_number VARCAHR(10) NOT NULL,
    ->     -> email VARCHAR(50) NOT NULL,
    ->     -> PRIMARY KEY (id)
    -> ^C  -> );
mysql> create table address_book
    ->     ->     -> (id INT unsigned NOT NULL AUTO_INCREMENT,
    ->     ->     -> first_name VARCHAR(150) NOT NULL,
    ->     ->     -> last_name VARCHAR(150),
    ->     ->     -> address VARCHAR(150) NOT NULL,
    ->     ->     -> city VARCHAR(150) NOT NULL,
    ->     ->     -> state VARCHAR(150) NOT NULL,
    ->     ->     -> ZIP INT NOT NULL,
    ->     ->     -> phone_number VARCAHR(10) NOT NULL,
    ->     ->     -> email VARCHAR(50) NOT NULL,
    ->     ->     -> PRIMARY KEY (id)
    ->     ->     -> );
ERROR 1064 (42000): You have an error in your SQL syntax; check the manual that corresponds to your MySQL server version for the right syntax to use near '->     -> (id INT unsigned NOT NULL AUTO_INCREMENT,
    ->     -> first_name VAR' at line 2
mysql> create table address_book
    -> (id INT unsigned NOT NULL AUTO_INCREMENT,
    -> first_name VARCHAR(150) NOT NULL,
    ->  last_name VARCHAR(150),
    -> address VARCHAR(150) NOT NULL,
    -> city VARCHAR(150) NOT NULL,
    -> state VARCHAR(150) NOT NULL,
    ->  ZIP INT unsigned NOT NULL,
    ->  phone_number VARCAHR(150) NOT NULL,
    -> email VARCHAR(150) NOT NULL,
    -> PRIMARY KEY (id)
    -> );
ERROR 1064 (42000): You have an error in your SQL syntax; check the manual that corresponds to your MySQL server version for the right syntax to use near 'VARCAHR(150) NOT NULL,
email VARCHAR(150) NOT NULL,
PRIMARY KEY (id)
)' at line 9
mysql> create table address_book
    ->  (id INT unsigned NOT NULL AUTO_INCREMENT,
    ->  first_name VARCHAR(150) NOT NULL,
    ->  last_name VARCHAR(150),
    -> address VARCHAR(150) NOT NULL,
    ->  city VARCHAR(150) NOT NULL,
    -> state VARCHAR(150) NOT NULL,
    ->  ZIP INT unsigned NOT NULL,
    ->  phone_number VARCHAR(10) NOT NULL,
    -> email VARCHAR(150) NOT NULL,
    -> PRIMARY KEY (id)
    -> );
Query OK, 0 rows affected (2.29 sec)

mysql> describe employeeBook
    -> ^C
mysql> describe employeeBook;
ERROR 1146 (42S02): Table 'addressbook.employeebook' doesn't exist
mysql> describe addressbook
    -> ^C
mysql> describe addressbook;
ERROR 1146 (42S02): Table 'addressbook.addressbook' doesn't exist
mysql> describe addressbook();
ERROR 1064 (42000): You have an error in your SQL syntax; check the manual that corresponds to your MySQL server version for the right syntax to use near '()' at line 1
mysql> INSERT INTO address_book (first_name,last_name,address,city,state,ZIP,phone_number,email) VALUES(
    -> 'Jitendra','Patel','Lunawas Khara','Jodhpur','Rajasthan',342014,'9636638082','jitu@gmail.com')
    -> ('Ram','Babu','Jhanwar','Jalore','Rajasthan',342067,'9571908082','ram@gmail.com');
ERROR 1064 (42000): You have an error in your SQL syntax; check the manual that corresponds to your MySQL server version for the right syntax to use near '('Ram','Babu','Jhanwar','Jalore','Rajasthan',342067,'9571908082','ram@gmail.com'' at line 3
mysql> INSERT INTO address_book (first_name,last_name,address,city,state,ZIP,phone_number,email) VALUES(
    ->  'Jitendra','Patel','Lunawas Khara','Jodhpur','Rajasthan',342014,'9636638082','jitu@gmail.com'),
    -> ('Ram','Babu','Jhanwar','Jalore','Rajasthan',342067,'9571908082','ram@gmail.com');
Query OK, 2 rows affected (0.47 sec)
Records: 2  Duplicates: 0  Warnings: 0

mysql> select*from employee_book
    -> ^C
mysql> select*from employee_book;
ERROR 1146 (42S02): Table 'addressbook.employee_book' doesn't exist
mysql> select*from address_book;
+----+------------+-----------+---------------+---------+-----------+--------+--------------+----------------+
| id | first_name | last_name | address       | city    | state     | ZIP    | phone_number | email          |
+----+------------+-----------+---------------+---------+-----------+--------+--------------+----------------+
|  1 | Jitendra   | Patel     | Lunawas Khara | Jodhpur | Rajasthan | 342014 | 9636638082   | jitu@gmail.com |
|  2 | Ram        | Babu      | Jhanwar       | Jalore  | Rajasthan | 342067 | 9571908082   | ram@gmail.com  |
+----+------------+-----------+---------------+---------+-----------+--------+--------------+----------------+
2 rows in set (0.10 sec)

mysql> update address_book set zip=342001 where name='Jitendra';
ERROR 1054 (42S22): Unknown column 'name' in 'where clause'
mysql> update address_book set zip=342001 where  first_name='Jitendra';
Query OK, 1 row affected (0.14 sec)
Rows matched: 1  Changed: 1  Warnings: 0

mysql> select*from address_book;
+----+------------+-----------+---------------+---------+-----------+--------+--------------+----------------+
| id | first_name | last_name | address       | city    | state     | ZIP    | phone_number | email          |
+----+------------+-----------+---------------+---------+-----------+--------+--------------+----------------+
|  1 | Jitendra   | Patel     | Lunawas Khara | Jodhpur | Rajasthan | 342001 | 9636638082   | jitu@gmail.com |
|  2 | Ram        | Babu      | Jhanwar       | Jalore  | Rajasthan | 342067 | 9571908082   | ram@gmail.com  |
+----+------------+-----------+---------------+---------+-----------+--------+--------------+----------------+
2 rows in set (0.06 sec)

mysql> DELETE FROM address_book WHERE first_name='Jitendra';
Query OK, 1 row affected (0.14 sec)

mysql> select*from address_book;
+----+------------+-----------+---------+--------+-----------+--------+--------------+---------------+
| id | first_name | last_name | address | city   | state     | ZIP    | phone_number | email         |
+----+------------+-----------+---------+--------+-----------+--------+--------------+---------------+
|  2 | Ram        | Babu      | Jhanwar | Jalore | Rajasthan | 342067 | 9571908082   | ram@gmail.com |
+----+------------+-----------+---------+--------+-----------+--------+--------------+---------------+
1 row in set (0.05 sec)

mysql> select first_name,last_name from address_book where city='Jalore' AND state='Rajasthan';
+------------+-----------+
| first_name | last_name |
+------------+-----------+
| Ram        | Babu      |
+------------+-----------+
1 row in set (0.00 sec)

mysql> select count(city),count(state) from address_book;
+-------------+--------------+
| count(city) | count(state) |
+-------------+--------------+
|           1 |            1 |
+-------------+--------------+
1 row in set (0.46 sec)

mysql> select * from address_book where city='Jalore' order by first_name, last_name asc;
+----+------------+-----------+---------+--------+-----------+--------+--------------+---------------+
| id | first_name | last_name | address | city   | state     | ZIP    | phone_number | email         |
+----+------------+-----------+---------+--------+-----------+--------+--------------+---------------+
|  2 | Ram        | Babu      | Jhanwar | Jalore | Rajasthan | 342067 | 9571908082   | ram@gmail.com |
+----+------------+-----------+---------+--------+-----------+--------+--------------+---------------+
1 row in set (0.10 sec)

mysql> alter table address_book add type VARCHAR(150) after last_name;
Query OK, 0 rows affected (5.00 sec)
Records: 0  Duplicates: 0  Warnings: 0

mysql> select * from address_book where city='Jalore' order by first_name, last_name asc;
+----+------------+-----------+------+---------+--------+-----------+--------+--------------+---------------+
| id | first_name | last_name | type | address | city   | state     | ZIP    | phone_number | email         |
+----+------------+-----------+------+---------+--------+-----------+--------+--------------+---------------+
|  2 | Ram        | Babu      | NULL | Jhanwar | Jalore | Rajasthan | 342067 | 9571908082   | ram@gmail.com |
+----+------------+-----------+------+---------+--------+-----------+--------+--------------+---------------+
1 row in set (0.10 sec)

mysql> update address_book set type='brother' where first_name='Ram';
Query OK, 1 row affected (0.30 sec)
Rows matched: 1  Changed: 1  Warnings: 0

mysql> select count(type) from address_book;
+-------------+
| count(type) |
+-------------+
|           1 |
+-------------+
1 row in set (0.04 sec)

mysql> insert info address_book(first_name,last_name,type,address,city,state,ZIP,phone_number,email) values
    -> ( 'Ramesh','Patel','Friend','Lunawas Khara','Jodhpur','Rajasthan',342014,'9636638082','jitu@gmail.com'),
    -> ( 'Ramesh','Patel','Family','Lunawas Khara','Jodhpur','Rajasthan',342014,'9636638082','jitu@gmail.com');
ERROR 1064 (42000): You have an error in your SQL syntax; check the manual that corresponds to your MySQL server version for the right syntax to use near 'address_book(first_name,last_name,type,address,city,state,ZIP,phone_number,email' at line 1
mysql> INSERT INFO address_book(first_name,last_name,type,address,city,state,ZIP,phone_number,email) VALUES
    -> ( 'Ramesh','Patel','Friend','Lunawas Khara','Jodhpur','Rajasthan',342014,'9636638082','jitu@gmail.com'),
    -> ( 'Ramesh','Patel','Family','Lunawas Khara','Jodhpur','Rajasthan',342014,'9636638082','jitu@gmail.com');
ERROR 1064 (42000): You have an error in your SQL syntax; check the manual that corresponds to your MySQL server version for the right syntax to use near 'address_book(first_name,last_name,type,address,city,state,ZIP,phone_number,email' at line 1
mysql> insert info address_book(first_name,last_name,type,address,city,state,ZIP,phone_number,email) values
    ->     -> ( 'Ramesh','Patel','Friend','Lunawas Khara','Jodhpur','Rajasthan',342014,'9636638082','jitu@gmail.com');
ERROR 1064 (42000): You have an error in your SQL syntax; check the manual that corresponds to your MySQL server version for the right syntax to use near 'address_book(first_name,last_name,type,address,city,state,ZIP,phone_number,email' at line 1
mysql> INSERT INFO address_book(first_name,last_name,type,address,city,state,ZIP,phone_number,email) VALUES(
    ->  'Ramesh','Patel','Friend','Lunawas Khara','Jodhpur','Rajasthan',342014,'9636638082','jitu@gmail.com');
ERROR 1064 (42000): You have an error in your SQL syntax; check the manual that corresponds to your MySQL server version for the right syntax to use near 'address_book(first_name,last_name,type,address,city,state,ZIP,phone_number,email' at line 1
mysql> INSERT INTO address_book (first_name,last_name,address,city,state,ZIP,phone_number,email) VALUES(
    ->     ->  'Jitendra','Patel','Friend','Lunawas Khara','Jodhpur','Rajasthan',342014,'9636638082','jitu@gmail.com');
ERROR 1064 (42000): You have an error in your SQL syntax; check the manual that corresponds to your MySQL server version for the right syntax to use near '->  'Jitendra','Patel','Friend','Lunawas Khara','Jodhpur','Rajasthan',342014,'96' at line 2
mysql>  INSERT INTO address_book (first_name,last_name,type,address,city,state,ZIP,phone_number,email) VALUES(
    ->  'Jitendra','Patel','Friend','Lunawas Khara','Jodhpur','Rajasthan',342014,'9636638082','jitu@gmail.com');
Query OK, 1 row affected (0.21 sec)

mysql> INSERT INTO address_book (first_name,last_name,type,address,city,state,ZIP,phone_number,email) VALUES(
    -> 'Jitendra','Patel','Family','Lunawas Khara','Jodhpur','Rajasthan',342014,'9636638082','jitu@gmail.com');
Query OK, 1 row affected (0.28 sec)

mysql> select*from address_book
    -> ^C
mysql> select*from address_book;
+----+------------+-----------+---------+---------------+---------+-----------+--------+--------------+----------------+
| id | first_name | last_name | type    | address       | city    | state     | ZIP    | phone_number | email          |
+----+------------+-----------+---------+---------------+---------+-----------+--------+--------------+----------------+
|  2 | Ram        | Babu      | brother | Jhanwar       | Jalore  | Rajasthan | 342067 | 9571908082   | ram@gmail.com  |
|  3 | Jitendra   | Patel     | Friend  | Lunawas Khara | Jodhpur | Rajasthan | 342014 | 9636638082   | jitu@gmail.com |
|  4 | Jitendra   | Patel     | Family  | Lunawas Khara | Jodhpur | Rajasthan | 342014 | 9636638082   | jitu@gmail.com |
+----+------------+-----------+---------+---------------+---------+-----------+--------+--------------+----------------+
3 rows in set (0.00 sec)

mysql>